id,title,author,views_count,position
1,Установка видеонаблюдения и домофонии во Владивостоке,Primtec,922,1
2,"Установка/обслуживание: видеонаблюдения, домофонов, СКУД, сигнализации во Владивостоке",ИП Якименко Алексей Андреевич,1365,2
3,"Монтаж видеонаблюдения Hikvision HiWatch Trassir, СКУД, домофонов во Владивостоке",doneit,506,3
4,Видеонаблюдение Установка Продажа Настройка Видеокамер IP во Владивостоке,TVi MART,1460,4
5,Качественная установка монтаж видеонаблюдения на любой объект во Владивостоке,Primtec,311,5
6,"ВидеоКИТ - Системы видеонаблюдения, установка, обслуживание во Владивостоке",VideoKIT,168,6
7,Установим Видеодомофон в квартиру или частный дом! Видеонаблюдение во Владивостоке, Подряд,116,7
8,Установка видеонаблюдения от Vladrec | Монтаж | Обслуживание | СКУД во Владивостоке,VLADREC,184,8
9,Установка видеонаблюдения. Монтаж Частный мастер во Владивостоке,AndreyVideo2016,93,9
10,Продажа и установка видеонаблюдения. Монтаж любой сложности! Гарантия во Владивостоке,Точка-Видео,3891,10
